start	end	text
3196280	3207000	sweet. Okay. Now that we've talked about that, let's talk a little bit about inheritance and
3207000	3211480	subclassing. I'm going to bring the caption here so you know what we're talking about.
3213000	3221320	Now, inheritance and subclassing are so, so important in Dart and in any other object-oriented
3221320	3226600	programming language that I don't think anybody should jump over it. Like, for instance, I know
3227320	3232120	developers working in various programming languages that are object-oriented, but they kind of steer
3232120	3238440	clear of the object-oriented aspects of that language. Maybe they don't need it and maybe
3238440	3243480	they just feel like it's unnecessary or they feel like, oh, it's just too complicated.
3243480	3248520	But in Dart, if you want to become a good Flutter developer or a good Dart developer, you need to
3248520	3260920	know about classes and inheritance. So, let's talk about inheritance. What inheritance in Dart is,
3260920	3270200	is that it allows you to define a class and then to add more functionality to that class
3271000	3281000	into a new class. So, let's, for instance, say we go into our test function here and remove that,
3281080	3290360	okay, that code, and also remove the person class. Now, let's create a class living thing,
3290360	3300920	all right, and then we say void, breathe, and then we say print. Living thing is breathing,
3300920	3307400	okay? So, we created a class living thing, and we're saying that anything that lives needs to
3307400	3312440	breathe. Now, this may be an assumption, but anyways, anything that lives and is above the
3314600	3321640	ground and is basically alive is breathing, okay? So, that's our function on the living thing. Now,
3322440	3329240	you may say, okay, any living thing may also have the ability to move, okay? Then we have
3329240	3336600	a function called move. I'm going to say print, I am moving, all right? So, now you may say, okay,
3336600	3344120	now I kind of want a class called cat, all right. Cat is also a living thing. One way to do that,
3344120	3351160	to go about creating a class, the cat class is to say class cat, and then you say, hmm,
3351160	3355720	I kind of need these functions, and you'll go and copy it, and then you paste them here,
3355720	3364920	all right? And then you say, okay, I'm good to go now. But one of the absolute paramount qualities
3364920	3373960	of a developer is that developers do not like to repeat themselves, and it is such an important
3373960	3378600	concept in programming that you need to avoid repeating yourself, that you need to just coin
3378600	3385000	that down now, get it straight so that you don't make this mistake as we're doing in this code
3385000	3390760	right now. So, the first thing you want to do as a developer is say, how can I grab this code?
3391480	3398520	And it's obvious that the cat is also a living thing. So, that's where you want to use the
3398520	3406360	extends keyword that allows you to inherit the functionality inside the living thing class
3406360	3413000	into your cat class. So, in this case, I'm saying cat class extends or read it in English as inherits
3413720	3420040	living thing, all right? So, you can see that the cat class in itself is empty right now,
3420040	3430520	but if you go to the test function and I say, final, fluffers is a cat, and then I can say
3430520	3438600	fluffers, you can see that now that the cat class has breathe and move functionalities,
3438600	3444200	or functions, actually. So, although cat itself didn't define these functions,
3444200	3450760	but they're available for the instance in this case called fluffers of type cat to use. So,
3450760	3458040	you can just say move, and then you can say fluffers, okay? So, if I run this code,
3458040	3462360	if I delete everything in the debug console and run this code, you can see that the cat
3462360	3467800	instance called fluffers is saying move, or I am moving, and it will also say living thing is
3467800	3478680	breathing, okay? Now, we could also talk about, now that we're talking about inheritance and
3478680	3485160	subclassing. Actually, maybe I shouldn't call it subclassing, but I also think it's important
3485160	3488680	for you to understand what subclassing is. Subclassing is literally the same thing as
3488680	3493160	inheritance. Subclassing is saying that you have a class and you're creating a subcomponent, like a
3493160	3500440	subthing of it, which may actually have, it's a little bit of a strange name in sub because
3500440	3506280	sub means kind of like a subset of things available in that class, but it actually is like a superset
3506280	3512600	because it will grab everything, like the cat at the moment has every functionality in living thing,
3512600	3519240	right? But it may not necessarily do that. It's kind of complicated to explain, but if you hear
3519240	3528600	subclassing or inheritance, know that that is what we mean. You use the extents keyword, usually,
3528600	3536600	okay? All right. Now, we've talked about inheritance and subclassing.
3538520	3546040	So, I'm gonna move a little bit my notes around, sorry about that, that I'm looking away from the
3546040	3554760	screen, and now we're gonna talk about abstract classes, all right? There's good documentation
3554760	3564520	about abstract classes, and what we're gonna do here is to just change this class living thing
3564520	3575480	at the moment to abstract, and you'll see that everything works as expected. Well, an abstract
3575480	3583720	class is very similar to a normal class, and there's good documentation about what an abstract
3583720	3588280	class actually is from a Dart perspective, and you can see it says use the abstract modifier to
3588280	3596200	define an abstract class that cannot be instantiated, all right? So, an abstract class is just like a
3596200	3599480	normal class that can't have instances. So,
